{
  "experiments": {
    "exp1": {
      "branch": "treatment-a"
    }
  },
  "addon_version": "20210115035053",
  "release_channel": "release",
  "locale": "en-US",
  "event": "IMPRESSION",
  "client_id": "c4beb4bf-4feb-9c4e-9587-9323b28c2e50",
  "version": "86",
  "message_id": "INFOBAR_ACTION_86",
  "browser_session_id": "93714e76-9919-ca49-b697-5e7c09a1394f"
}
